{
  "status": "completed",
  "message": "已生成并校验通过第2版脚本，满足3秒目标。",
  "missing_fields": [],
  "questions": [],
  "script": {
    "version": 2,
    "title": "字幕功能介绍",
    "scenes": [
      {
        "id": "scene1",
        "visual": "字幕功能介绍",
        "voiceover": "支持字幕。",
        "subtitle": "支持字幕",
        "claims": [
          {
            "text": "支持字幕",
            "source_id": "P01",
            "fact_id": "P01-F1"
          }
        ],
        "estimated_duration_seconds": 1.5
      }
    ],
    "estimated_total_duration_seconds": 1.5
  },
  "checks": {
    "script_version": 2,
    "duration": "passed",
    "facts": "passed",
    "brand": "passed",
    "issues": []
  },
  "risks": [
    "时长为启发式估算；事实检查仅覆盖受控表达。"
  ],
  "tool_calls_used": 5
}
