{
  "status": "needs_input",
  "message": "请补充目标时长 target_duration_seconds。",
  "missing_fields": [
    "target_duration_seconds"
  ],
  "questions": [
    "target_duration_seconds"
  ],
  "script": null,
  "checks": {
    "script_version": null,
    "duration": "not_run",
    "facts": "not_run",
    "brand": "not_run",
    "issues": []
  },
  "risks": [
    "时长为启发式估算；事实检查仅覆盖受控表达。"
  ],
  "tool_calls_used": 0
}
